<?xml version="1.0" encoding="UTF-8" ?>

<xsd:schema xmlns:xsd="http://www.w3.org/2001/XMLSchema">
	
	<xsd:element name="pokemons" type="Pokemons" />
	
	<xsd:complexType name="Pokemons">
		<xsd:sequence>
			<xsd:element name="pokemon" type="Pokemon" minOccurs="0" maxOccurs="unbounded" />
		</xsd:sequence>
	</xsd:complexType>
	
	<xsd:complexType name="Pokemon">
		<xsd:simpleContent>
			<xsd:extension base="xsd:string">
				<xsd:attribute name="id" type="xsd:int" use="required" />
			</xsd:extension>
		</xsd:simpleContent>
	</xsd:complexType>

</xsd:schema>